index,year_start,year_end,date,era,event,detail
225,600,600,c. 600 ,Medieval,Deliberate fires set for unknown reasons destroy major buildings in Teotihuacan.,Destroys the Teotihuacan civilization and empire. Tikal is now the largest city-state in Mesoamerica.
226,602,602,602–629 ,Medieval,Last great Roman–Persian War.,Long conflict leaves both empires exhausted and unable to cope with the newly united Arab armies under Islam in the 630s
227,604,604,604–609 ,Medieval,Grand Canal in China is fully completed,Its main role throughout its history was the transport of grain to the capital.
228,618,618,01 June 618 – 18 June 907,Medieval,Tang dynasty in China.,The essential administrative system of this dynasty lasts for 286 years.
229,622,622,9 September – 23 September 622,Medieval,Muhammad migrates from Mecca to Medina.,"Event will have designated first year of the Islamic calendar, as Anno Hegirae."
230,626,626,626,Medieval,Joint Persian–Avar–Slav Siege of Constantinople,"Constantinople saved, Avar power broken and Persians henceforth on the defensive"
231,627,627,627 December 12,Medieval,Battle of Nineveh.,"The Byzantines, under Heraclius, crush the Persians."
232,632,632,632 June 8,Medieval,Death of Muhammad,"By this point, all of Arabia is Muslim."
233,632,632,632–668 ,Medieval,Establishment and expansion of Old Great Bulgaria.,The demise of Old Great Bulgaria lead to the founding of the First Bulgarian Empire and Volga Bulgaria by the sons of Kubrat.
234,632,632,632 June 8,Medieval,Accession of Abu Bakr as first Caliph.,"Though the period of his caliphate was not long, it included successful invasions of the two most powerful empires of the time."
235,633,633,633–634 ,Medieval,Battle of Heavenfield.,Northumbrian army under Oswald defeat Welsh army.
236,638,638,638,Medieval,"Jerusalem captured by the Arab army, mostly Muslims, but with contingents of Syrian Christians.",
237,641,641,641,Medieval,Battle of Nahavand. Muslims conquer Persia.,
238,643,643,643,Medieval,Arab Army led by Amr ibn al-As takes Alexandria.,
239,645,645,645,Medieval,"In Japan, the Soga clan falls.","This initiates a period of imitation of Chinese culture, The Nara period begins a year later."
240,650,650,650,Medieval,Slav occupation of Balkans complete.,
241,650,650,c. 650 ,Medieval,The city-state Xochicalco is founded by the Olmeca–Xicallanca.,Becomes an important cultural and commercial center.
242,663,663,663,Medieval,Synod of Whitby.,Roman Christianity triumphs over Celtic Christianity in England.
243,668,668,668,Medieval,End of the Three Kingdoms period in Korea.,Established a Unified Silla which led to the North–South States Period 30 years later.
244,674,674,674–678 ,Medieval,First Arab siege of Constantinople.,"First time Islamic armies defeated, forestalling Islamic conquest of Europe."
245,681,681,681,Medieval,Establishment of the Bulgarian Empire.,A country with great influence in the European history in the Middle Ages.
246,685,685,685,Medieval,Battle of Dun Nechtain.,"Picts defeat Northumbrians, whose dominance ends."
247,687,687,687,Medieval,Battle of Tertry,"Established Pepin of Herstal as mayor over the entire realms of Neustria and Austrasia, which further dwindled Merovingian power."
248,698,698,698,Medieval,Arab army takes Carthage.,End of Byzantine rule in North Africa
249,698,698,698,Medieval,North–South States Period begins in Korea.,"Silla and Balhae coexisted in the south and north of the peninsula, respectively, until 926"
250,711,711,711,Medieval,Umayyad conquest of Hispania under Tarik.,Will begin a period of Muslim rule within in the Al-Andalus (with various portions of Iberian peninsula) until nearly the end of the Fifteenth Century.
251,718,718,718,Medieval,"Second Arab attack on Constantinople, ending in failure.",The combined Byzantine–Bulgarian forces stop the Arab threat in Southeastern Europe.
252,726,726,726,Medieval,"Iconoclast movement begun in the Byzantine Empire under Leo III. This was opposed by Pope Gregory II, and an important difference between the Roman and Byzantine churches.",
253,732,732,732 October,Medieval,Battle of Tours. Charles Martel halts Muslim advance.,"Significant moment that led to the forming of the Carolingian Empire for the Franks, and halted the advancement of the Moors in southwestern Europe."
254,735,735,735 26 May,Medieval,Death of Bede.,"Bede was later regarded as ""the father of English history"""
255,750,750,750 25 January,Medieval,Beginning of Abbasid Caliphate.,"Would become the longest lasting caliphate, until 1519 when conquered and annexed into the Ottoman Empire."
256,751,751,751,Medieval,Pepin the Short founds the Carolingian dynasty.,
257,754,754,754,Medieval,Pepin promises the Pope central Italy. This is arguably the beginning of the temporal power of the Papacy.,
258,768,768,768,Medieval,Beginning of Charlemagne's reign.,
259,778,778,778 15 August,Medieval,Battle of Roncevaux Pass.,
260,786,786,786 14 September,Medieval,Accession of Harun al-Rashid to the Caliphate in Baghdad.,
261,793,793,793,Medieval,Sack of Lindisfarne. Viking attacks on Britain begin.,"Generally considered the beginning of the Viking Age that would span over two centuries, and reach as far south as Hispania and as far east as the Byzantine Empire, and present day Russia."
262,794,794,794,Medieval,Heian period in Japan.,Considered to be the last classical period of History of Japan. Chinese influence was at its strongest during this era in Japan.
263,795,795,795 29 July,Medieval,Death of Offa.,Marks the end of Mercian dominance in England.
264,800,800,800 25 December,Medieval,Charlemagne is crowned Holy Roman Emperor.,"With his crowning, Charlemagne's kingdom is officially recognized by the Papacy as the largest in Europe since the fall of the Roman Empire."
265,800,800,800,Medieval,Gunpowder is invented in China (somewhere around 9th century),
266,814,814,814 28 January,Medieval,Death of Charlemagne.,Would be a factor towards the splitting of his empire almost 30 years later.
267,820,820,820,Medieval,Algebrae et Alumcabola Algorithm,Muhammad ibn Musa- al-Khwarizmi
268,825,825,825,Medieval,Battle of Ellandun.  Egbert defeats Mercians.,Wessex becomes the leading kingdom of England.
269,827,827,827,Medieval,Muslims invade Sicily.,"First encounter of attempts to conquer Byzantine Sicily, until the last Byzantine outpost was conquered in 965."
270,840,840,840,Medieval,Muslims capture Bari and much of southern Italy.,
271,843,843,843,Medieval,Division of Charlemagne's Empire between his grandsons with the Treaty of Verdun.,Sets the stage for the founding of the Holy Roman Empire and France as separate states.
272,843,843,843,Medieval,"Kenneth McAlpin becomes king of the Picts and Scots, creating the Kingdom of Alba.",
273,862,862,862,Medieval,"Viking state in Russia founded under Rurik, first at Novgorod, then Kiev.",
274,864,864,864,Medieval,Christianization of Bulgaria.,
275,866,866,866,Medieval,Fujiwara period in Japan.,Would become the most powerful clan during the Heian period in Japan for around three centuries.
276,866,866,866,Medieval,Viking Great Army arrives in England.,"Northumbria, East Anglia, and Mercia were overwhelmed."
277,868,868,868,Medieval,Earliest known printed book in China with a date.,
278,871,871,871,Medieval,"Alfred the Great assumes the throne, the first king of a united England.","He defended England from Viking invaders, formed new laws and fostered a rebirth of religious and scholarly activities."
279,872,872,c. 872 ,Medieval,Harold Fairhair becomes King of Norway.,
280,874,874,874,Medieval,Iceland is settled by Norsemen.,
281,882,882,882,Medieval,Kievan Rus' is established.,"Would be sustained until the Mongol invasion of Rus' over four and a half centuries, despite peaking during the middle 11th century during the reign of Yaroslav the Wise."
282,885,885,885,Medieval,Arrival of the disciples of Saints Cyril and Methodius in Bulgaria,Creation of the Cyrillic script  in the following decades the country became the cultural and spiritual centre of the whole Eastern Orthodox part of the Slavic World.
283,885,885,885–886 ,Medieval,Vikings attack Paris.,
284,893,893,893,Medieval,Emperor Simeon I becomes ruler of the First Bulgarian Empire in the Balkans.,Golden age of the First Bulgarian Empire (896–927). The Cyrillic alphabet was developed in the Preslav Literary School and Ohrid Literary School.
285,896,896,896,Medieval,Arpad and the Magyars are present in Pannonia.,
286,899,899,27 October 899,Medieval,Death of Alfred the Great.,
287,900,900,c. 900 ,Medieval,Lowland Maya cities in the south collapse.,Signifies the end of the Classic Period of Maya history. The Maya in northern Yucatán continue to thrive.
288,907,907,907,Medieval,Tang Dynasty ends with Emperor Ai deposed.,The Five Dynasties and Ten Kingdoms period in China commences.
289,910,910,910,Medieval,"King Edward the Elder of England, son of King Alfred, defeats the Northumbrian Vikings at the Battle of Tettenhall; they never raid south of the River Humber again.",
290,910,910,910,Medieval,"Cluny Abbey is founded by William I, Count of Auvergne.",Cluny goes on to become the acknowledged leader of Western Monasticism. Cluniac Reforms initiated with the abbey's founding.
291,911,911,911,Medieval,"The Viking Rollo and his tribe settle in what is now Normandy by the terms of the Treaty of Saint-Clair-sur-Epte, founding the Duchy of Normandy.",
292,913,913,913,Medieval,Sri Kesari Warmadewa reigned in Walidwipa (Bali),
293,917,917,917,Medieval,Battle of Anchialus. Simeon I the Great defeats the Byzantines.,Recognition of the Imperial Title of the Bulgarian rulers.
294,919,919,919,Medieval,"Henry the Fowler, Duke of Saxony elected German King.  First king of the Ottonian Dynasty.",Henry I considered the founder and first king of the medieval German state.
295,925,925,925,Medieval,"The first King of Croatia (rex Croatorum), Tomislav (910–928) of the Trpimirović dynasty was crowned.","Tomislav united Croats of Dalmatia and Pannonia into a single Kingdom, and created a sizeable state."
296,927,927,927,Medieval,"King Aethelstan the Glorious unites the heptarchy of The Anglo-Saxon  nations of Wessex, Sussex, Essex, Kent, East Anglia, Mercia and Northumbria founding the Kingdom of England.",
297,927,927,927,Medieval,"According to Theophanes Continuatus (The Continuer of Theophanes's Chronicle) – Tomislav of Croatia defeated Bulgarian army of Tsar Simeon I under Duke Alogobotur, in battle of the Bosnian Highlands.",Bulgarian expansion to the west was stopped.
298,927,927,927,Medieval,"Death of Simeon I the Great. Recognition of the Bulgarian Patriarchate, the first independent National Church in Europe.",
299,929,929,929,Medieval,Abd-ar-Rahman III of the Umayyad dynasty in al-Andalus (part of the Iberian peninsula) takes the title of Caliph or ruler of the Islamic world.,Beginning of the Caliphate of Córdoba (929–1031).
300,936,936,936,Medieval,Wang Geon unified Later Three Kingdoms of Korea.,
301,938,938,938,Medieval,Ngo Quyen won the battle of Bach Dang against Chinese Southern Han army.,This event marked the independence of Vietnam after 1000 years under Chinese colony.
302,955,955,955,Medieval,"Battle of Lechfeld. Otto the Great, son of Henry the Fowler, defeats the Magyars.",This is the defining event that prevents the Hungarians from entering Central Europe.
303,960,960,c.960 ,Medieval,Mieszko I becomes duke of Polans.,First historical ruler of Poland and de facto founder of the Polish State.
304,960,960,960,Medieval,"Song Dynasty begins after Emperor of Taizu usurps the throne from the Later Zhou, last of the Five Dynasties.",A 319-year period of Song rule (Northern & Southern combined) goes underway.
305,962,962,962,Medieval,Otto the Great crowned the Holy Roman Emperor.,First to be crowned Holy Roman Emperor in nearly 40 years.
306,963,963,963–964 ,Medieval,Otto deposes Pope John XII who is replaced with Pope Leo VIII.,Citizens of Rome promise not to elect another Pope without Imperial approval.
307,965,965,965–967 ,Medieval,"Mieszko I of Poland and his court embrace Christianity, which becomes national religion.",
308,969,969,969,Medieval,John I Tzimiskes and Nikephoros II are executed.,Sultane of Rums are proclaimed.
309,976,976,976,Medieval,Death of John I Tzimiskes,Under Basil II zenith of the power of Eastern Empire after Justinian.
310,978,978,978,Medieval,Al-Mansur Ibn Abi Aamir becomes de facto ruler of Muslim Al-Andalus.,"Peak of power of Moorish Iberia under ""Almanzor""."
311,981,981,981,Medieval,"Basil II (called ""Bulgar Slayer"") begins final conquest of Bulgaria by Eastern Empire.",Conquest finished by 1018.
312,985,985,985,Medieval,"Eric the Red, exiled from Iceland, begins Scandinavian colonization of Greenland.",
313,987,987,987,Medieval,Succession of Hugh Capet to the French Throne.,Beginning of Capetian Dynasty.
314,988,988,988,Medieval,"Volodymyr I of Kiev embraces Christianity, which becomes national religion.",
315,989,989,989,Medieval,Peace and Truce of God formed.,"The first movement of the Catholic Church using spiritual means to limit private war, and the first movement in medieval Europe to control society through non-violent means."
316,1001,1001,c. 1001 ,Medieval,Leif Ericson is to settle during the winter in present-day Canada at L'Anse aux Meadows.,Ericson is to be the first European to settle in the Americas during the Norse exploration of the Americas.
317,1016,1016,1016,Medieval,"Canute the Great becomes King of England after the death of Edmund Ironside, with whom he shared the English throne.",Danes become kings of England for the next 26 years before the last rise of the Anglo-Saxons before the Norman Conquest.
318,1018,1018,1018,Medieval,The Byzantines under Basil II conquer Bulgaria after a bitter 50-years struggle.,Concludes the Byzantine conquest of Bulgaria.
319,1021,1021,1021,Medieval,"The Tale of Genji, written by Murasaki Shikibu, is completed sometime before this date.","It is sometimes called the world's first novel, the first modern novel, the first psychological novel or the first novel still to be considered a classic."
320,1025,1025,1025,Medieval,The Canon of Medicine,Persian Avicenna set standard medical textbook through 18th century in Europe
321,1037,1037,1037,Medieval,The Great Seljuk Empire is founded by Tughril Beg.,"Would be a major force during the first two Crusades, and an antagonist to the Byzantine Empire over the next century."
322,1049,1049,1049,Medieval,Pope Leo IX ascends to the papal throne.,"Leo IX was the pope that excommunicated Patriarch of Constantinople, Michael Cerularius (who also excommunicated Leo), which caused the Great Schism."
323,1050,1050,1050,Medieval,"The astrolabe, an ancient tool of navigation, is first used in Europe.","Early tool of marine navigators, astrologers, astronomers."
324,1050,1050,1050,Medieval,Westminster Abbey,Edward the Confessor
325,1054,1054,1054,Medieval,The East-West Schism which divided the church into Western Catholicism and Eastern Orthodoxy.,Tensions will vary between the Catholic and Orthodox churches throughout the Middle Ages.
326,1066,1066,1066,Medieval,"William the Conqueror, Duke of Normandy, invades England and becomes King after the Battle of Hastings.",End of Anglo-Saxon rule in England and start of Norman lineage.
327,1067,1067,1067,Medieval,Pope Gregory VII elevated to the papal throne.,This begins a period of church reform.
328,1071,1071,1071,Medieval,"The Seljuks under Alp Arslan defeat the Byzantine army at Manzikert. The Normans capture Bari, the last Byzantine possession in southern Italy.",Beginning of the end of Byzantine rule in Asia Minor.
329,1075,1075,1075,Medieval,Dictatus Papae in which Pope Gregory VII defines the powers of the pope.,"Peak of the Gregorian Reform, and an immense factor in the Investiture Controversy."
330,1077,1077,1077,Medieval,"Holy Roman Emperor Henry IV  walks to Canossa where he stands barefoot in the snow to beg forgiveness of the Pope for his offences, and admitting defeat in the Investiture Controversy.",This helps establish Papal rule over European heads of state for another 450 years.
331,1077,1077,1077,Medieval,The Construction of the Tower of London begins.,The tower of London was the ultimate keep of the British Empire.
332,1086,1086,1086,Medieval,"The compilation of the Domesday Book, a great land and property survey commissioned by William the Conqueror to assess his new possessions.",This is the first such undertaking since Roman times.
333,1088,1088,1088,Medieval,University of Bologna is formed.,It is the oldest university in Europe.
334,1095,1095,1095,Medieval,"Pope Urban issues the Crusades to capture the Holy Land, and to repel the Seljuk Turks from the Byzantine Empire from Alexios I Komnenos.","This would be the first of 9 Major Crusades, and a number of other crusades that would spread into the late 13th century."
335,1098,1098,1098,Medieval,The Cistercian Order is founded.,Was a return to the original observance of the Rule of St. Benedict.
336,1099,1099,1099,Medieval,First Crusade. Jerusalem is re-taken from the Muslims on the urging of Pope Urban II.,"This would lead to the beginning of the Kingdom of Jerusalem, which would last for nearly two centuries; within the era of the Crusades to the Holy Land."
337,1100,1100,1100,Medieval,"Latin-translation of the great masters of Arabic medicine: Rhazes, Ishaq Ibn Imran, Ibn Suleiman, and Ibn al-Jazzar",Constantine the African
338,1102,1102,1102,Medieval,Kingdom of Croatia and Kingdom of Hungary formed a personal union of two kingdoms united under the Hungarian king.,"Medieval Hungary and Croatia were (in terms of public international law) allied by means of personal union until 1526. Although, Hungarian-Croatian state existed until the beginning of the 20th century and the Treaty of Trianon."
339,1102,1102,1102,Medieval,Synods of Westminster,"End of simony, clerical marriages, slavery under Anselm of Canterbury"
340,1106,1106,1106 28 September,Medieval,"Henry I of England defeats his older brother Robert Curthose, duke of Normandy, at the Battle of Tinchebrai, and imprisons him in Devizes castle; Edgar Atheling and William Clito are also taken prisoner.",This victory made a later struggle between England and the rising Capetian power in France inevitable.
341,1107,1107,1107,Medieval,"Through the Compromise of 1107, suggested by Adela, the sister of King Henry, the Investiture Struggle in England is ended.",This compromise removed one of the points of friction between the English monarchy and the Catholic Church.
342,1109,1109,1109,Medieval,"In the Battle of Naklo, Boleslaus III Wrymouth defeats the Pomeranians.",Polish access to the sea is re-established.
343,1109,1109,1109 24 August,Medieval,"In the Battle of Hundsfeld, Boleslaus III Wrymouth defeats Emperor Henry V.",German expansion to the centre of Europe is stopped.
344,1116,1116,1116,Medieval,The Byzantine army defeats the Turks at Philomelion.,The Turks abandon the entire coastal area of Anatolia and all of western Anatolia
345,1117,1117,1117,Medieval,The University of Oxford is founded.,It is the oldest university in the United Kingdom.
346,1118,1118,1118,Medieval,The Knights Templar are founded to protect Jerusalem and European pilgrims on their journey to the city.,"Becomes the most recognizable, and impactful military orders during the Crusades."
347,1121,1121,1121 25 December,Medieval,St. Norbert and 29 companions make their solemn vows marking the beginning of the Premonstratensian Order.,"This order played a significant role in evangelizing the Slavs, the Wends, to the east of the Holy Roman Empire."
348,1122,1122,1122 23 September,Medieval,The Concordat of Worms was drawn up between Emperor Henry V and Pope Calixtus II.,"This concordat ended the investiture struggle, but bitter rivalry between emperor and pope remained."
349,1123,1123,1123 18 March - 27 March,Medieval,The First Lateran Council followed and confirmed the Concordat of Worms.,
350,1125,1125,1125,Medieval,School of Glossators,Irnerius
351,1125,1125,1125,Medieval,"Lothair of Supplinburg, duke of Saxony, is elected Holy Roman Emperor instead of the nearest heir, Frederick of Swabia.",This election marks the beginning of the great struggle between the Guelfs and the Ghibellines.
352,1125,1125,1125–1127 ,Medieval,Jingkang Incident,"The Jurchen soldiers sack Kaifeng, bringing an end to the Northern Song Dynasty in China; the Song moves further south and makes Lin'an their new capital."
353,1130,1130,1130 25 December,Medieval,"Roger II is crowned King of Sicily, a Royal title given him by the Antipope Anacletus II.","This coronation marks the beginning of the Kingdom of Sicily and its Mediterranean empire under the Norman kings, which was able to take on the Holy Roman Empire, the Papacy, and the Byzantine Empire."
354,1130,1130,1130,Medieval,Sic et Non,Peter Abelard
355,1135,1135,1135,Medieval,The Anarchy begins in England.,"This will mark a 19-year period of Government strife and Civil War between the supporters of Stephen and Matilda, and end with the crowning of Matilda's son, Henry II, and beginning the Plantagenet dynasty."
356,1139,1139,1139 April,Medieval,"The Second Lateran Council declared clerical marriages invalid, regulated clerical dress, and punished attacks on clerics by excommunication.",Enforces the major reforms that Gregory VII began to heavily campaign for several decades earlier.
357,1140,1140,1140,Medieval,Decretum,Gratian
358,1144,1144,1144,Medieval,Rebuild of Basilica of Saint Denis,Suger
359,1147,1147,1147–1149 ,Medieval,"The Second Crusade was in retaliation for the fall of Edessa, one of the first Crusader States founded in the First Crusade. It was an overall failure.",This was the first Crusade to have been led by European kings.
360,1150,1150,1150,Medieval,"Ramon Berenguer IV, Count of Barcelona, married Queen Petronilla of Aragon. They had been betrothed in 1137.","This marriage gave the Kingdom of Aragon access to the Mediterranean Sea, creating a powerful kingdom which expanded to control many of the Mediterranean lands."
361,1150,1150,1150,Medieval,Founding of the University of Paris,
362,1152,1152,1152,Medieval,The Synod of Kells-Mellifont established the present diocesan system of Ireland (with later modifications) and recognized the primacy of Armagh.,This synod marks the inclusion of the Irish Church into mainstream European Catholicism.
363,1154,1154,1154,Medieval,Common Law,Henry II
364,1158,1158,1158,Medieval,The Hanseatic League is founded.,This marks a new period of trade and economic development for northern and central Europe.
365,1163,1163,1163,Medieval,The first cornerstone is laid for the construction of Notre Dame de Paris.,
366,1166,1166,1166,Medieval,"Stefan Nemanja united Serbian territories, establishing the Medieval Serbian state.",This marks the rise of Serbia which will dominate the Balkans for the next three hundred years. Allies of Serbia at this moment become the Hungarian Kingdom and the Republic of Venice.
367,1171,1171,1171,Medieval,King Henry II of England lands in Ireland to assert his supremacy and the Synod of Cashel acknowledges his sovereignty.,"With his landing, Henry begins the English claim to and occupation of Ireland which would last some seven and a half centuries."
368,1174,1174,1174 7/12,Medieval,"King William I of Scotland, captured in the Battle of Alnwick by the English, accepts the feudal lordship of the English crown and does ceremonial allegiance at York.",This is the beginning of the gradual acquisition of Scotland by the English.
369,1175,1175,1175,Medieval,Hōnen Shōnin (Genkū) founds the Jōdo shū (Pure Land) sect of Buddhism.,This event marks the beginning of the Buddhist sectarian movement in Japan.
370,1176,1176,1176 5/29,Medieval,"At the Battle of Legnano, the cavalry of Frederick Barbarossa is defeated by the infantry of the Lombard League.","This is the first major defeat of cavalry by infantry, signaling the new role of the bourgeoisie."
371,1175,1175,1175,Medieval,Latin-translation,Gerard of Cremona
372,1179,1179,1179,Medieval,church schools,Third Council of the Lateran
373,1179,1179,1179 March,Medieval,"The Third Lateran Council limits papal electees to the cardinals alone, condemns simony, and forbids the promotion of anyone to the episcopate before the age of thirty.",
374,1183,1183,1183,Medieval,"The final Peace of Constance between Frederick Barbarossa, the pope, and the Lombard towns is signed.",The various articles of the treaty destroyed the unity of the Empire and Germany and Italy underwent separate developments.
375,1183,1183,1183,Medieval,The Taira clan are driven out of Kyōto by Minamoto Yoshinaka.,The two-year conflict which follows ends at the Battle of Dan no Ura (1185).
376,1184,1184,1184 November,Medieval,Pope Lucius III issues the papal bull Ad Abolendam.,This bull set up the organization of the medieval inquisitions.
377,1185,1185,1185,Medieval,Windmills are first recorded.,
378,1185,1185,1185,Medieval,Uprising of Asen and Peter. The reestablishment of the Bulgarian Empire.,
379,1185,1185,1185,Medieval,"At the Battle of Dan no Ura, Minamoto Yoshitsune annihilates the Taira clan.",The elimination of the Taira leaves the Minamoto the virtual rulers of Japan and marks the beginning of the first period of feudal rule known as the Kamakura Period.
380,1186,1186,1186 1/27,Medieval,"The future emperor Henry VI marries Constance of Sicily, heiress to the Sicilian throne.",This marriage shifts the focus of the Guelphs/Ghibelline struggle to Sicily and marks the ruin of the House of Hohenstaufen.
381,1187,1187,1187,Medieval,Saladin recaptures Jerusalem.,Would lead to the Third Crusade.
382,1188,1188,1188,Medieval,Tractatus of Glanvil,Oxford University
