index,year_start,year_end,date,era,event,detail
383,1189,1189,1189 July 6,Medieval,Richard I ascends the throne of England.,"His heavy taxation to finance his European ventures created an antipathy of barons and people toward the crown, but his being absent enabled the English to advance in their political development."
384,1189,1189,1189–1192 ,Medieval,The Third Crusade follows upon Saladin's uniting the Muslim world and recapturing Jerusalem.,"Despite managing to win several major battles, the Crusaders did not recapture Jerusalem."
385,1192,1192,1192,Medieval,"Minamoto no Yoritomo is appointed Sei-i Taishōgun, or shōgun for short.",He is the first of a long line of military dictators to bear this title. The institution would last until 1913.
386,1193,1193,1193,Medieval,Muhammad bin Bakhtiyar Khilji sack and burn the university at Nalanda.,This is the beginning of the decline of Buddhism in India.
387,1193,1193,1193,Medieval,The first known merchant guild.,
388,1195,1195,1195,Medieval,Battle of Alarcos The Almohad Caliphate decisively defeat the Kingdom of Castile.,The Almohads pushed Christians to the north and stablished themselves as the supreme power in Al-Andalus
389,1199,1199,1199,Medieval,Europeans first use compasses.,
390,1202,1202,1202,Medieval,"The Fourth Crusade sacked Croatian town of Zadar (Italian: Zara), a rival of Venice despite letters from Pope Innocent III forbidding it.",Siege of Zara was the first major Crusade's action and the first attack against a Catholic city by Catholic crusaders.
391,1204,1204,1204,Medieval,Sack of Constantinople during the Fourth Crusade.,Considered to be the beginning of the decline of the Byzantine Empire.
392,1205,1205,1205,Medieval,Battle of Adrianople. The Bulgarians under Emperor Kaloyan defeat Baldwin I.,Beginning of the decline of the Latin Empire.
393,1206,1206,1206,Medieval,Genghis Khan was elected as Khagan of the Mongols and the Mongol Empire was established.,"The Mongols would conquer much of Eurasia, changing former political borders."
394,1208,1208,1208,Medieval,Pope Innocent III calls for the Albigensian Crusade which seeks to destroy a rival form of Christianity practiced by the Cathars.,
395,1209,1209,1209,Medieval,The University of Cambridge is founded.,
396,1209,1209,1209,Medieval,Founding of the Franciscan Order.,"One of the more significant orders in the Roman Catholic church, founded by Saint Francis of Assisi."
397,1212,1212,1212,Medieval,"Spanish Christians succeed in defeating the Moors in the long Reconquista campaigns, after the Battle of Las Navas de Tolosa.","By 1238, only the small southern Emirate of Granada remained under Muslim control."
398,1215,1215,1215 15 June,Medieval,The Magna Carta is sealed by John of England.,This marks one of the first times a medieval ruler is forced to accept limits on his power.
399,1215,1215,1215,Medieval,"Fourth Lateran Council. Dealt with transubstantiation, papal primacy and conduct of clergy. Proclaimed that Jews and Muslims should wear identification marks to distinguish them from Christians.",
400,1216,1216,1216,Medieval,Papal recognition of the Dominican Order.,
401,1219,1219,1219,Medieval,"Serbian Orthodox Church becomes autocephalous under St. Sava, its first Archbishop.",
402,1227,1227,1227 18 August,Medieval,Genghis Khan dies.,"His kingdom is divided among his children and grandchildren: Empire of the Great Khan, Chagatai Khanate, Mongolian Homeland, and the Blue Horde and White Horde (which would later become the Golden Horde)."
403,1237,1237,1237–1240 ,Medieval,Mongol invasion of Rus' resumes.,"Causes the split of Kievan Rus' into three components (present day Russia, Ukraine, Belarus, greatly effects various regions of raided lands in other parts of Europe; Golden Horde formed."
404,1257,1257,1257,Medieval,Opening of the College of Sorbonne.,
405,1257,1257,1257,Medieval,Provisions of Oxford forced upon Henry III of England.,This establishes a new form of government-limited regal authority.
406,1258,1258,1258 29 January– 10 February,Medieval,Siege of Baghdad by Ilkhanate Mongol forces,Mongols (the Ilkhanate) ensure control of the region.  Generally considered the end of the Islamic Golden Age.
407,1258,1258,1258,Medieval,The first Mongol invasion of Vietnam,The Mongol army was defeated by emperor Tran Thai Tong of Đại Việt
408,1272,1272,1272–73 ,Medieval,The Ninth Crusade occurs.,Considered to be the Last Major Crusade to take place in the Holy Land.
409,1273,1273,1273 29 September,Medieval,Rudolph I of Germany is elected Holy Roman Emperor.,This begins the Habsburg de facto domination of the crown that lasted until is dissolution in 1806.
410,1274,1274,1274,Medieval,"Thomas Aquinas' work, Summa Theologica is published, after his death.",Is the main staple of theology during the Middle Ages.
411,1279,1279,1279 19 March,Medieval,Battle of Yamen.,"Marks the end of the Song Dynasty in China, and all of China is under the rule of Kublai Khan as the emperor."
412,1282,1282,1282,Medieval,"Sicilian Vespers. Sicilians massacre Angevins over a six-week period, after a Frenchman harassed a woman.","Would mark a two decade period of war, and peace treaties mainly between Aragon, Sicily, and the Angevins."
413,1283,1283,1283,Medieval,First regulated Catalan Courts.,"Presided by king Peter III of Aragon for the whole Principality of Catalonia, it became in one of the first parliamentary bodies that banned the royal power to create legislation unilaterally."
414,1285,1285,1285,Medieval,The second Mongol invasion of Vietnam,The Mongol army was defeated by emperor Tran Nhan Tong and general Tran Hung Dao.
415,1287,1287,1287,Medieval,The third Mongol invasion of Vietnam,"Decisive Vietnam victory. To avoid further conflict, Đại Việt agreed to a tributary relationship with the Yuan dynasty"
416,1296,1296,1296,Medieval,"Edward I of England invades Scotland, starting the First War of Scottish Independence.",
417,1297,1297,1297 11 September,Medieval,The Battle of Stirling Bridge.,William Wallace emerges as the leader of the Scottish resistance to England.
418,1298,1298,1298,Medieval,"Marco Polo publishes his tales of China, along with Rustichello da Pisa.",A key step to the bridging of Asia and Europe in trade.
419,1299,1299,1299 27 July,Medieval,The Ottoman Empire is founded by Osman I.,"Becomes longest lasting Islamic Empire, lasting over 600 years into the 20th century."
420,1305,1305,23 August 1305,Medieval,William Wallace is executed for treason.,
421,1307,1307,13 October 1307,Medieval,"The Knights Templar are rounded up and murdered by Philip the Fair of France, with the backing of the Pope.",Hastens the demise of the order within a decade.
422,1307,1307,1307,Medieval,Beginning of the Babylonian Captivity of the Papacy during which the Popes moved to Avignon.,Begins a period of over seven decades of the Papacy outside of Rome that would be one of the major factors of the Western Schism.
423,1310,1310,1310,Medieval,Dante publishes his Divine Comedy.,"Is one of the most defining works of literature during the Late Middle Ages, and among the most recognizable in all of literature."
424,1314,1314,1314 23–24 June,Medieval,Battle of Bannockburn.,Robert the Bruce restores Scotland's de facto independence.
425,1325,1325,1325,Medieval,The Mexica found the city of Tenochtitlan.,This would later be the epicenter and capital of the Aztec Empire until the Siege of Tenochtitlan 200 years later.
426,1328,1328,1328,Medieval,The First War of Scottish Independence ends in Scottish victory with the Treaty of Edinburgh-Northampton and de jure independence.,
427,1323,1323,1323,Medieval,Romance of the three kingdoms,
428,1330,1330,1330 28 July,Medieval,Battle of Velbazhd.,
429,1333,1333,1333,Medieval,"Emperor Go-Daigo returns to the throne from exile, and begins the Kenmu restoration.","The Kamakura Shogunate comes to an end, and the Kenmu Restoration only lasts a few years before the Ashikaga Shogunate begins."
430,1337,1337,1337,Medieval,The Hundred Years' War begins. England and France struggle for a dominating position in Europe and their region.,The war will span through three/four different war periods within a 116-year period.
431,1346,1346,1346 August 26th,Medieval,Battle of Crécy.,"English forces led by Edward III and Edward, the Black Prince defeat the French forces of Philip VI despite being outnumbered at least 4 to 1, with the longbow being a major factor in favor of England. Also considered to be the beginning of the end of classic chivalry."
432,1347,1347,1347,Medieval,The Black Death ravages Europe for the first of many times. An estimated 20% – 40% of the population is thought to have perished within the first year.,"The first of many concurrences of this plague, This was believed to have wiped out as many as 50% of Europe's population by its end."
433,1347,1347,1347,Medieval,The University of Prague is founded.,It is the oldest Czech and German-Speaking University in the world
434,1364,1364,1364,Medieval,Astrarium,Giovanni de dondi
435,1368,1368,1368,Medieval,"The fall of the Yuan Dynasty. Its remnants, known as Northern Yuan, continued to rule Mongolia.","The breakup of the Mongol Empire, which marked the end of Pax Mongolica."
436,1370,1370,1370,Medieval,Tamerlane establishes the Timurid Dynasty.,"During this 35-year period, Tamerlane would ravage his fellow Islamic states such as the Golden Horde and the Delhi Sultanate in order to accomplish his goal of a restored Mongol Empire."
437,1378,1378,1378,Medieval,The Western Schism during which three claimant popes were elected simultaneously.,The Avignon Papacy ends.
438,1380,1380,1380,Medieval,Prince Dmitry Donskoy of Moscow led a united Russian army to a victory over the Mongols in the Battle of Kulikovo.,
439,1380,1380,1380,Medieval,Chaucer begins to write The Canterbury Tales.,"Chaucer's greatest work, and one of the foundations towards the formation of the Modern English language"
440,1381,1381,1381,Medieval,Peasants' Revolt in England.,"Quickest-spread revolt in English history, and the most popular revolt of the Late Middle Ages."
441,1381,1381,1381,Medieval,The Bible is translated into English by John Wycliffe.,First print published in English (Vulgate)
442,1386,1386,1386 October 18–19th,Medieval,The University of Heidelberg is founded.,It is the oldest university in Germany.
443,1389,1389,1389 June 28th,Medieval,Battle of Kosovo in Serbia.,"This was in many respects the decisive battle between the Turks, led by Sultan Murat, and Christian army, led by the Serbs and their duke Lazar. The battle took place in Kosovo, the southern province of the Medieval Serbian Empire. After this battle Turkish empire continued to spread over the Balkans, to finally reach Vienna."
444,1392,1392,1392,Medieval,Joseon Dynasty founded in Korea.,Becomes longest reigning Korean dynasty.
445,1396,1396,1396,Medieval,The Battle of Nicopolis.,The last great Crusade fails. Bulgaria was conquered by the Ottomans
446,1397,1397,1397,Medieval,The Kalmar Union is formed.,"Queen Margaret I of Denmark unites the Denmark, Sweden, and Norway, and lasts until 1523."
447,1399,1399,1399,Medieval,"Richard II abdicates the throne to Henry of Bolingbroke, who becomes Henry IV of England.","End of Plantagenet Dynasty, beginning of the Lancaster lineage of kings."
448,1402,1402,20 July 1402,Medieval,Battle of Ankara,"Bayezid I is captured by Tamerlane's forces, causing the interregnum of the Ottoman Empire."
449,1405,1405,1405,Medieval,"Chinese naval expeditions of Southeast Asia and the Indian Ocean (to Eastern Africa) begin, under the leadership of Zheng He.","This will be the first of seven of the Ming Dynasty-sponsored expeditions, lasting until 1433."
450,1409,1409,1409,Medieval,"Ladislaus of Naples sells his ""rights"" on Dalmatia to the Venetian Republic for 100,000 ducats.","Dalmatia would with some interruptions remain under Venetian rule for nearly four centuries, until 1797."
451,1410,1410,1410,Medieval,Battle of Grunwald,"Major turning point in history of Lithuania, Poland and the Teutonic Order."
452,1415,1415,1415,Medieval,Kingdom of Portugal conquers Ceuta.,Beginning of the Portuguese Empire. Beginning of the Age of Discovery.
453,1415,1415,25 October 1415,Medieval,"Battle of Agincourt. Henry V and his army defeat a numerically superior French army, partially because of the newly introduced English longbow.","The turning point in the Hundred Years' War for 15th-century England that leads to the signing of the Treaty of Troyes five years later, making Henry V heir to the throne of France."
454,1417,1417,1417,Medieval,The Council of Constance ends.,"The Western Schism comes to a close, and elects Pope Martin V as the sole pope."
455,1419,1419,1419,Medieval,"Hussite Wars begin after four years after the death of Jan Hus in central Europe, dealing with the followers of Jan Hus and those against them.","Although the war was a stalemate (ended around 1434), it was another factor that[clarification needed] between the Catholics and Protestants before the Protestant Reformation."
456,1428,1428,1428,Medieval,"Itzcoatl, the fourth Mexica king in Tenochtitlán, allied with Texcoco and Tlacopan, defeats Azcapotzalco.","Signifies the birth of the Aztec Empire and the start of an aggressive expansion lasting 90 years. Itzcoatl and his men began burning historic hieroglyphic books of conquered states, rewriting history with the Mexica at its center."
457,1429,1429,1429,Medieval,"Joan of Arc lifts the siege of Orléans for the Dauphin of France, enabling him to eventually be crowned at Reims.",The battle at Orléans is the first of many which ultimately drive the English from continental Europe.
458,1431,1431,30 May 1431,Medieval,Trial and execution of Joan of Arc.,Death of the woman who helped turn the Hundred Years' War in favor of the French over the past two years.
459,1434,1434,1434,Medieval,The Medici family rises to prominence in Florence.,"This ushers in a period of significance of the Medicis, such as bankers, popes, queens (regents) and dukes, throughout Europe (mainly Italy, especially the Florentine Republic), over the next three centuries."
460,1434,1434,1434,Medieval,Aronolfini Portrait Jan Van Eyck,evidence on usage of convex mirror
461,1438,1438,1438,Medieval,Prince Cusi Yupanqui becomes the first Inca emperor.,Inca civilization begins expanding and the Inca Empire is born.
462,1439,1439,1439,Medieval,Johannes Gutenberg invents the printing press.,"Literature, news, etc. becomes more accessible throughout Europe."
463,1442,1442,1442,Medieval,Battle of Szeben,Third significant victory for the Hungarian forces led by Janos Hunyadi over the Ottoman forces.
464,1443,1443,1443,Medieval,Sejong the Great creates Hangul,Koreans gain an alphabet suited to their language
465,1444,1444,10 November 1444,Medieval,Battle of Varna,"Final battle of the Crusade of Varna; Ottomans are victorious over the Hungarian-Polish armies, and Władysław III of Poland dies."
466,1452,1452,1452,Medieval,Coronation of Frederick III,
467,1453,1453,1453,Medieval,Constantinople falls to the Ottoman Turks.,End of the Byzantine Empire (or Eastern Roman Empire to some) Constantinople becomes capital of Ottoman Empire.
468,1453,1453,1453,Medieval,The Hundred Years' War ends.,"England's once vast territory in France is now reduced to only Calais, which they eventually lose control of as well."
469,1455,1455,22 May 1455,Medieval,Battle of St. Albans,Traditionally marks the beginning of the War of the Roses.
470,1456,1456,1456,Medieval,Siege of Belgrade,Major Ottoman advances are halted for seven decades  last major victory for Hunyadi.
471,1459,1459,1459,Medieval,Smederevo falls under the Turks,Marks the end of the Medieval Serbian state.
472,1461,1461,1461,Medieval,The Empire of Trebizond falls to the Ottoman Turks.,Last Roman outpost to be conquered by the Ottomans.
473,1464,1464,1464,Medieval,Dardanelles gun,Turkish Munir Ali
474,1467,1467,1467–1477 ,Medieval,Ōnin War takes place in Japan.,First of many significant civil wars between shogunates that would continue for another century during the Muromachi period.
475,1475,1475,1475,Medieval,The Khanate of Crimea is conquered and made a vassal state by the Ottoman Empire.,Venice is defeated and the Ottoman Empire becomes master of the Aegean Sea.
476,1485,1485,1485,Medieval,Thomas Malory composes Le Morte d'Arthur,Perhaps the best-known work of Arthurian literature in English.
477,1485,1485,22 August 1485 ,Medieval,Battle of Bosworth Field.,"Richard III dies in battle, and Henry Tudor becomes king of England; last shift of Houses/kingship during the War of the Roses."
478,1487,1487,1487 June 16,Medieval,Battle of Stoke.,Marks end of the War of the Roses.
479,1492,1492,1492,Medieval,Reconquista ends.,Marks end of Moorish-Muslim rule within Iberian Peninsula  Unification of Spain.
480,1492,1492,1492,Medieval,Christopher Columbus reaches the New World.,Age of Discovery into the New World begins.
481,1494,1494,June 10 1494,Medieval,Spain and Portugal sign the Treaty of Tordesillas and agree to divide the World outside of Europe between themselves.,"Pope's ruling will lead to the division of Brazil and Spanish America, as well as the formation of the Spanish Philippines and Portuguese colonies in India and Africa."
482,1494,1494,1494–1559,Medieval,The Italian Wars which eventually will lead to the downfall of the Italian city-states.,
483,1497,1497,1497,Medieval,Vasco da Gama begins his first voyage from Europe to India and back.,Vasco da Gama was the first European to sail directly to Eastern Asia from Europe.
484,1499,1499,1499,Medieval,Ottoman fleet defeats Venetians at the Battle of Zonchio.,The first naval battle that used cannons in ships.
